date,tweet_count,summary
2026-03-05,165,"Markets are dominated by the Iran conflict (Day 5), with oil surging to $100/bbl in China, KOSPI experiencing historic volatility (12% crash then 12% rebound), and defense/space stocks rallying. The AI/optics supply chain remains the strongest secular theme, with GOOGL rejecting CPO benefiting pluggable optics names (AAOI, LITE, FN), while Broadcom beat earnings and NVIDIA deepened its Coherent partnership. Geopolitical risk is creating both fear-driven dislocations (South Korea, energy) and momentum in defense, LNG, and US-centric AI infrastructure plays."
2026-03-05,168,"Markets are navigating an intense geopolitical backdrop with the Iran conflict in its fifth day, driving record put protection and a historic single-day KOSPI crash of 12%, though South Korean markets are rebounding sharply as fears of LNG supply disruption prove overblown. The AI/photonics optics trade remains the dominant theme, with AAOI, LITE, COHR, and AXTI all surging on hyperscaler demand and Google's rejection of CPO benefiting the pluggable optics ecosystem. Broadcom's earnings beat and $100B AI forecast, combined with SpaceX's $1.75T pre-IPO valuation ahead of a June listing, are creating sector-wide tailwinds for semis and space stocks respectively."
2026-03-04,172,"Markets are whipsawing around the Iran conflict with South Korea's KOSPI crashing 12% then rebounding 12% as fears over Strait of Hormuz disruptions to semiconductor supply chains proved overblown. The photonics/optical networking trade remains red-hot with AAOI, LITE, COHR, and AXTI surging on hyperscaler demand and Google's rejection of CPO benefiting pluggable optics. Space stocks are catching a bid ahead of SpaceX's $1.75T IPO in June, while defense/energy names benefit from Middle East escalation and record put protection signals extreme fear that could fuel further rebounds."
2026-03-04,129,"Markets are whipsawed by the escalating Iran conflict (Day 5, US submarine torpedoing Iranian warship) and a historic KOSPI crash/rebound cycle, while AI/semiconductor names find support from Broadcom's earnings beat and continued HBM/memory demand narratives. Defensive rotation into defense/AI infrastructure names like PLTR and TSM is evident, with South Korea ETFs offering a high-risk tactical rebound play after a 12% single-day crash followed by a 12% bounce."
2026-03-05,168,Analysis unavailable (JSON parse error).
2026-03-04,163,Analysis unavailable (JSON parse error).
2026-03-04,7,"South Korean markets are experiencing a sharp V-shaped rebound after a historic sell-off driven by the US-Iran conflict, with KOSPI surging ~12% and semiconductor heavyweights SK Hynix and Samsung leading the recovery. The AI/optics sector remains volatile with AAOI trading well above analyst price targets despite record revenue, while geopolitical risk-off sentiment appears to be fading as oil prices stabilize."
2026-03-04,3,"South Korean markets are experiencing a sharp rebound after a 7% plunge earlier in the week, with KOSPI surging 11.6% led by semiconductor giants SK Hynix (+15.78%) and Samsung (+14.4%). The recovery suggests the Iran war fears that triggered the sell-off were overblown, and the AI buildout narrative remains intact. Social sentiment is turning strongly bullish with comparisons to crypto-like momentum in Korean index funds."
2026-03-02,3,"AAOI is surging on record Q4-2025 results and explosive forward guidance, with management forecasting demand could surge 10x driven by AI-related expansion. The stock has rallied over 40% post-earnings and is trading at its 52-week high, now well above analyst mean price targets. The tweet author expresses regret at missing a technical re-entry on the cup-and-handle breakout retest a month ago, underscoring the strength of the move."
2026-03-01,2,"AAOI is experiencing a massive rally, hitting 52-week highs near $84 after record Q4-2025 revenue and a forecast suggesting demand could surge 10x. The stock has already rallied over 40% on earnings and guidance, with the current price now exceeding analyst mean target of $77.30, suggesting the easy money has been made."
2026-03-01,1,"Colgate-Palmolive (CL) is trading near its 52-week high at $99.14, but faces a 'sell the news' dynamic as noted by traders. The stock is trading above the analyst mean target price of $97.21, suggesting limited upside, while carrying an elevated P/E of 37.7x."
2026-03-01,1,"Colgate-Palmolive (CL) is trading near its 52-week high at $99.14, up ~1.6% from previous close, but faces a 'sell the news' dynamic flagged by traders. The stock trades at a rich 37.7x trailing P/E, above the analyst mean target of $97.21, suggesting limited upside and potential overvaluation at current levels."
